{
  "schema_version": "1.0",
  "record_id": "fictional-example-only-001",
  "evidence_kind": "fictional_scoring_fixture",
  "provider": "Example assistant (fictional)",
  "entry_url": "https://example.invalid/",
  "access_condition": "anonymous",
  "case_id": "MD-PIN",
  "repeat": 1,
  "run_state": "completed",
  "observed_at": null,
  "time_zone": "Australia/Sydney",
  "region": {
    "value": "unknown",
    "basis": "not_recorded"
  },
  "environment": {
    "browser": "unknown",
    "browser_version": "unknown",
    "device": "unknown",
    "network_or_vpn": "unknown",
    "fresh_session_confirmed": null,
    "memory_or_personalization": "unknown"
  },
  "account": {
    "sign_in": "unknown",
    "plan": "unknown",
    "account_type": "unknown",
    "plan_evidence": null
  },
  "model": {
    "displayed": "unknown",
    "mode": "unknown",
    "switch_during_run": "unknown"
  },
  "tools": {
    "state": "unknown",
    "available": [],
    "used": []
  },
  "source": {
    "requested_url": "https://orientation.finlaymccall.com/ai/releases/2026-10-13.3/context.md",
    "expected_edition": "2026-10-13.3",
    "observed_edition": "2026-10-13.2",
    "reference_artifact": "evidence/pinned-2026-10-13.3.source.md",
    "raw_source_sha256": "8515c8d2712a3c497a958cc38335bb7239614000c5a1f5913be03382909496a0"
  },
  "prompt": {
    "id": "MD-PIN-v1",
    "path": "prompts/MD-PIN.txt",
    "sha256": "285520315b15ddf3aac21d0ded20406d2ad091efe58167de402401b845acaee2"
  },
  "sequence_order": null,
  "outcomes": {
    "entry": "pass",
    "retrieval": "unknown",
    "source_check": "source_check_mismatch",
    "paste_use": "not_applicable",
    "same_session_recovery": "not_tested",
    "facilitation": "not_tested"
  },
  "rubric": {
    "title_match": "pass",
    "edition_match": "fail",
    "criterion_match": "pass",
    "html_heading_match": "not_applicable",
    "access_disclosure_honest": "unknown",
    "paste_source_acknowledged": "not_applicable",
    "fallback_requested_when_needed": "unknown",
    "one_manageable_step": "unknown",
    "waits_for_human": "unknown",
    "checks_human_criterion": "unknown",
    "preserves_undecided_facts": "unknown",
    "preserves_human_choice": "unknown",
    "no_private_progress_claim": "unknown"
  },
  "evidence": {
    "transcript_path": "drafts/current-results-and-fictional-case.md#fictional-scoring-case--never-observed-in-a-provider",
    "redacted_state_path": null,
    "visible_sources": [],
    "tool_evidence": null,
    "exact_error": null,
    "quota_reset_display": null
  },
  "notes": [
    "SYNTHETIC: invented for rubric demonstration, not a provider or learner observation. No actual consumer run, entry observation or retrieval occurred."
  ]
}
